{"arms":{"AL":{"escalated_during":true,"final":{"defective":false,"defective_full":false,"o_failed":false},"model":"gpt-6-luna","model_calls":14,"seconds":1820,"selection_pass":false,"verdict":"escalate"},"ALL":{"escalated_during":true,"final":{"defective":false,"defective_full":false,"o_failed":false},"model":"gpt-6-luna","model_calls":31,"seconds":2460,"selection_pass":false,"verdict":"escalate"},"T":{"escalated_during":false,"final":{"defective":false,"defective_full":false,"o_failed":false},"model":"gpt-6-luna","model_calls":0,"seconds":120,"selection_pass":true,"verdict":"pass"},"TR":{"escalated_during":false,"final":{"defective":false,"defective_full":false,"o_failed":false},"model":"gpt-6-luna","model_calls":0,"seconds":150,"selection_pass":true,"verdict":"pass"}},"harness":"codex","language":"python","model":"gpt-6-luna","reached_s_t":true,"repository":"acme/pricing","s_n":{"defective":false,"defective_full":false,"o_failed":false},"s_t":{"defective":false,"defective_full":false,"o_failed":false},"schema":"specbench.trunk/1","task_id":"ACME-PRICING-5"}
